number,value,datetime_start,datetime_complete,duration,params_activation,params_batch_size_0,params_batch_size_1,params_batch_size_2,params_batch_size_3,params_batch_size_4,params_h1,params_h2,params_iter_no_change,params_learning_rate_init,params_max_iter,params_num_hidden_layers,params_preset_idx,state
0,0.9063865524091803,2025-11-29 23:30:41.168521,2025-11-29 23:30:45.876078,0 days 00:00:04.707557,relu,,128.0,,,,9,,29,0.0066986646382351306,354,1,1,COMPLETE
1,0.8938726586209385,2025-11-29 23:30:45.877216,2025-11-29 23:30:52.818426,0 days 00:00:06.941210,tanh,,,,,100.0,5,7.0,60,0.040002872220484244,246,2,4,COMPLETE
2,0.9199616638272128,2025-11-29 23:30:52.819482,2025-11-29 23:30:57.405417,0 days 00:00:04.585935,tanh,,256.0,,,,5,10.0,53,0.04056777182125825,393,2,1,COMPLETE
3,0.9278278441479395,2025-11-29 23:30:57.406791,2025-11-29 23:31:02.033281,0 days 00:00:04.626490,relu,,,,,200.0,5,3.0,16,0.003032593555760083,407,2,4,COMPLETE
4,0.9377188907719315,2025-11-29 23:31:02.034175,2025-11-29 23:31:14.255077,0 days 00:00:12.220902,relu,,,32.0,,,8,5.0,54,0.00895199714323823,385,2,2,COMPLETE
5,0.8977200427262356,2025-11-29 23:31:14.256249,2025-11-29 23:31:15.163473,0 days 00:00:00.907224,logistic,,,,,50.0,10,7.0,47,0.02084492754094985,277,2,4,PRUNED
6,0.9449819286204695,2025-11-29 23:31:15.164378,2025-11-29 23:31:36.067873,0 days 00:00:20.903495,logistic,32.0,,,,,8,7.0,68,0.004716523722948787,445,2,0,COMPLETE
7,0.913303199344457,2025-11-29 23:31:36.069116,2025-11-29 23:31:37.953769,0 days 00:00:01.884653,relu,,64.0,,,,11,7.0,30,0.0020747095747101494,324,2,1,PRUNED
8,0.9403301280127089,2025-11-29 23:31:37.954675,2025-11-29 23:31:43.862592,0 days 00:00:05.907917,relu,,,32.0,,,9,,21,0.011366934817053058,182,1,2,COMPLETE
9,0.9266540924240341,2025-11-29 23:31:43.863390,2025-11-29 23:31:53.925578,0 days 00:00:10.062188,tanh,32.0,,,,,8,,30,0.004674671473026911,335,1,0,COMPLETE
10,0.7432884009559574,2025-11-29 23:31:53.926537,2025-11-29 23:31:59.872789,0 days 00:00:05.946252,logistic,32.0,,,,,3,,79,0.00033614992523181645,541,1,0,PRUNED
11,0.852373835017447,2025-11-29 23:31:59.873612,2025-11-29 23:32:00.389116,0 days 00:00:00.515504,logistic,,,32.0,,,7,,5,0.014964765099786307,165,1,2,PRUNED
12,0.862690259728583,2025-11-29 23:32:00.390132,2025-11-29 23:32:06.959583,0 days 00:00:06.569451,logistic,,,,10.0,,7,,19,0.001072216945372607,482,1,3,PRUNED
13,0.8937747439105469,2025-11-29 23:32:06.960478,2025-11-29 23:32:08.150339,0 days 00:00:01.189861,relu,,,16.0,,,10,,18,0.013349727316555794,165,1,2,PRUNED
14,0.9163950875966594,2025-11-29 23:32:08.151218,2025-11-29 23:32:14.475388,0 days 00:00:06.324170,logistic,16.0,,,,,9,11.0,69,0.0018002796135471164,470,2,0,PRUNED
15,0.8675662113610008,2025-11-29 23:32:14.477155,2025-11-29 23:32:20.250435,0 days 00:00:05.773280,relu,,,,20.0,,11,,35,0.00036323875570929884,234,1,3,PRUNED
16,0.9107548331424115,2025-11-29 23:32:20.251349,2025-11-29 23:32:21.702221,0 days 00:00:01.450872,logistic,,,64.0,,,6,,39,0.006658632574702328,216,1,2,PRUNED
17,0.9114477491023718,2025-11-29 23:32:21.703063,2025-11-29 23:32:27.642611,0 days 00:00:05.939548,logistic,64.0,,,,,8,9.0,67,0.0006187315829926005,572,2,0,PRUNED
18,0.8927099960519743,2025-11-29 23:32:27.644247,2025-11-29 23:32:28.150642,0 days 00:00:00.506395,relu,,,32.0,,,9,,8,0.024314922191919074,296,1,2,PRUNED
19,0.869638886858979,2025-11-29 23:32:28.152023,2025-11-29 23:32:37.234649,0 days 00:00:09.082626,tanh,32.0,,,,,3,5.0,78,0.00020281751281501552,454,2,0,PRUNED
20,0.9057156790965804,2025-11-29 23:32:37.235483,2025-11-29 23:32:40.464884,0 days 00:00:03.229401,logistic,,,16.0,,,6,9.0,24,0.004366587309407679,197,2,2,PRUNED
21,0.9293601439066259,2025-11-29 23:32:40.465897,2025-11-29 23:32:51.047598,0 days 00:00:10.581701,relu,,,32.0,,,8,5.0,44,0.008794786226304096,395,2,2,COMPLETE
22,0.9305313125859038,2025-11-29 23:32:51.051189,2025-11-29 23:33:04.148432,0 days 00:00:13.097243,relu,,,32.0,,,8,5.0,51,0.009770416268014746,435,2,2,COMPLETE
23,0.9163109887799165,2025-11-29 23:33:04.149410,2025-11-29 23:33:07.359172,0 days 00:00:03.209762,relu,,,32.0,,,10,3.0,42,0.00681039614920441,366,2,2,PRUNED
24,0.9177290831138173,2025-11-29 23:33:07.360790,2025-11-29 23:33:08.761389,0 days 00:00:01.400599,relu,,,,40.0,,9,6.0,23,0.002755440356055832,421,2,3,PRUNED
25,0.9329769070277864,2025-11-29 23:33:08.762212,2025-11-29 23:33:18.034489,0 days 00:00:09.272277,relu,16.0,,,,,7,8.0,57,0.0032224855452387432,518,2,0,PRUNED
26,0.9315008249691044,2025-11-29 23:33:18.035752,2025-11-29 23:33:19.004319,0 days 00:00:00.968567,relu,,,64.0,,,7,,12,0.012112979979997024,371,1,2,PRUNED
27,0.9268563343930599,2025-11-29 23:33:19.005373,2025-11-29 23:33:21.071576,0 days 00:00:02.066203,relu,,,32.0,,,6,4.0,36,0.018443012845845527,298,2,2,PRUNED
28,0.9329268070735658,2025-11-29 23:33:21.072443,2025-11-29 23:33:39.431340,0 days 00:00:18.358897,tanh,64.0,,,,,10,,66,0.0012008781611552064,500,1,0,COMPLETE
29,0.9304359163372201,2025-11-29 23:33:39.432197,2025-11-29 23:33:40.660491,0 days 00:00:01.228294,logistic,,128.0,,,,9,6.0,73,0.007228432532857883,448,2,1,PRUNED
30,0.9283149169791562,2025-11-29 23:33:40.661379,2025-11-29 23:33:45.781389,0 days 00:00:05.120010,relu,,,,10.0,,8,,26,0.003389272200951898,349,1,3,PRUNED
31,0.9302632665332558,2025-11-29 23:33:45.782908,2025-11-29 23:33:50.401891,0 days 00:00:04.618983,tanh,64.0,,,,,10,,62,0.0010132215429633853,492,1,0,PRUNED
32,0.9283428738556523,2025-11-29 23:33:50.404252,2025-11-29 23:33:53.706228,0 days 00:00:03.301976,tanh,64.0,,,,,9,,63,0.0013066559640841978,590,1,0,PRUNED
33,0.9003611708470232,2025-11-29 23:33:53.707158,2025-11-29 23:33:57.888426,0 days 00:00:04.181268,tanh,32.0,,,,,11,,56,0.0007369143403356124,511,1,0,PRUNED
34,0.9239261935810993,2025-11-29 23:33:57.890864,2025-11-29 23:33:59.793956,0 days 00:00:01.903092,tanh,,,,,200.0,10,,51,0.005429655988469945,545,1,4,PRUNED
35,0.925624466406087,2025-11-29 23:33:59.794802,2025-11-29 23:34:01.556715,0 days 00:00:01.761913,tanh,,64.0,,,,9,,67,0.031145150112511313,413,1,1,PRUNED
36,0.9227823279157052,2025-11-29 23:34:01.557611,2025-11-29 23:34:08.668059,0 days 00:00:07.110448,tanh,,,,,50.0,8,8.0,55,0.011407251626728239,505,2,4,COMPLETE
37,0.9303661754522558,2025-11-29 23:34:08.669000,2025-11-29 23:34:10.799118,0 days 00:00:02.130118,relu,64.0,,,,,10,6.0,72,0.0024796338676436724,261,2,0,PRUNED
38,0.9209119969544701,2025-11-29 23:34:10.801713,2025-11-29 23:34:12.328311,0 days 00:00:01.526598,tanh,,256.0,,,,11,,60,0.0084836998777802,387,1,1,PRUNED
39,0.8995249899845136,2025-11-29 23:34:12.330282,2025-11-29 23:34:18.021044,0 days 00:00:05.690762,logistic,32.0,,,,,4,4.0,47,0.003951757057518147,539,2,0,PRUNED
40,0.9288892394115731,2025-11-29 23:34:18.021937,2025-11-29 23:34:22.496482,0 days 00:00:04.474545,relu,,,,,100.0,7,,52,0.01663654038050751,323,1,4,COMPLETE
41,0.9354406334824,2025-11-29 23:34:22.497439,2025-11-29 23:34:34.879521,0 days 00:00:12.382082,relu,,,32.0,,,8,5.0,47,0.00956511027905361,435,2,2,COMPLETE
42,0.8992877141812218,2025-11-29 23:34:34.880404,2025-11-29 23:34:36.900845,0 days 00:00:02.020441,relu,,,32.0,,,8,4.0,49,0.005481197637254737,431,2,2,PRUNED
43,0.9151433068899653,2025-11-29 23:34:36.901959,2025-11-29 23:34:39.260150,0 days 00:00:02.358191,relu,,,32.0,,,9,5.0,54,0.045774154671018516,462,2,2,PRUNED
44,0.9281623835577175,2025-11-29 23:34:39.261620,2025-11-29 23:34:48.567046,0 days 00:00:09.305426,relu,,,32.0,,,7,6.0,45,0.010606402358734352,440,2,2,COMPLETE
45,0.9341835011372581,2025-11-29 23:34:48.568076,2025-11-29 23:34:51.426413,0 days 00:00:02.858337,logistic,,,32.0,,,8,8.0,33,0.013668048808210799,403,2,2,PRUNED
46,0.9341312869388675,2025-11-29 23:34:51.428465,2025-11-29 23:35:00.097219,0 days 00:00:08.668754,relu,64.0,,,,,10,4.0,75,0.003524388905383033,479,2,0,COMPLETE
47,0.920081294230861,2025-11-29 23:35:00.098155,2025-11-29 23:35:06.935192,0 days 00:00:06.837037,relu,,,64.0,,,9,4.0,40,0.005852245385422182,151,2,2,COMPLETE
48,0.9365350115029859,2025-11-29 23:35:06.936163,2025-11-29 23:35:11.935321,0 days 00:00:04.999158,relu,16.0,,,,,7,3.0,75,0.0038408824410715156,480,2,0,PRUNED
49,0.9027200659388617,2025-11-29 23:35:11.936396,2025-11-29 23:35:15.973757,0 days 00:00:04.037361,relu,,,16.0,,,6,5.0,57,0.009220773661348053,456,2,2,PRUNED
50,0.9284698376259987,2025-11-29 23:35:15.974874,2025-11-29 23:35:18.477108,0 days 00:00:02.502234,relu,,,,40.0,,9,4.0,47,0.004119544252687509,425,2,3,PRUNED
51,0.9260915691359104,2025-11-29 23:35:18.477985,2025-11-29 23:35:34.834087,0 days 00:00:16.356102,logistic,64.0,,,,,10,7.0,80,0.001649048018442192,492,2,0,COMPLETE
52,0.9335753295422988,2025-11-29 23:35:34.835295,2025-11-29 23:35:47.767262,0 days 00:00:12.931967,relu,64.0,,,,,10,6.0,68,0.0034956126134725743,475,2,0,COMPLETE
53,0.9126207182149597,2025-11-29 23:35:47.768200,2025-11-29 23:35:49.744977,0 days 00:00:01.976777,relu,64.0,,,,,11,6.0,77,0.0036222612181505123,473,2,0,PRUNED
54,0.9401443657336891,2025-11-29 23:35:49.745814,2025-11-29 23:36:03.637313,0 days 00:00:13.891499,relu,64.0,,,,,8,5.0,70,0.0024115923225624916,529,2,0,COMPLETE
55,0.9348408737203668,2025-11-29 23:36:03.638180,2025-11-29 23:36:07.963866,0 days 00:00:04.325686,relu,,,32.0,,,8,5.0,58,0.002856825794957237,385,2,2,PRUNED
56,0.9231697249558973,2025-11-29 23:36:07.965634,2025-11-29 23:36:29.577362,0 days 00:00:21.611728,relu,32.0,,,,,8,3.0,70,0.0020090585942886727,531,2,0,COMPLETE
57,0.9348488370129809,2025-11-29 23:36:29.578335,2025-11-29 23:36:46.461038,0 days 00:00:16.882703,relu,,,32.0,,,7,4.0,59,0.007737941001959382,193,2,2,COMPLETE
58,0.9179461767755264,2025-11-29 23:36:46.462018,2025-11-29 23:36:51.428374,0 days 00:00:04.966356,logistic,,,32.0,,,7,5.0,53,0.007845806843676044,202,2,2,PRUNED
59,0.9336982533423829,2025-11-29 23:36:51.429225,2025-11-29 23:37:03.294185,0 days 00:00:11.864960,relu,,,32.0,,,7,7.0,55,0.0048675644617240145,183,2,2,COMPLETE
60,0.9369842075838334,2025-11-29 23:37:03.295155,2025-11-29 23:37:05.113689,0 days 00:00:01.818534,relu,,,32.0,,,6,10.0,58,0.0128418923429259,240,2,2,PRUNED
61,0.936642249291235,2025-11-29 23:37:05.114928,2025-11-29 23:37:07.460486,0 days 00:00:02.345558,relu,,,32.0,,,8,4.0,59,0.006252753745957095,220,2,2,PRUNED
62,0.9223611562918249,2025-11-29 23:37:07.461591,2025-11-29 23:37:08.629744,0 days 00:00:01.168153,relu,,,32.0,,,8,4.0,15,0.01023992380465341,183,2,2,PRUNED
63,0.9380479856313381,2025-11-29 23:37:08.630631,2025-11-29 23:37:19.739408,0 days 00:00:11.108777,relu,64.0,,,,,8,3.0,65,0.004477606431420149,255,2,0,COMPLETE
64,0.9409850044795514,2025-11-29 23:37:19.740309,2025-11-29 23:37:20.351985,0 days 00:00:00.611676,relu,,256.0,,,,8,3.0,65,0.007926096186504163,277,2,1,PRUNED
65,0.8563090409722213,2025-11-29 23:37:20.352914,2025-11-29 23:37:24.678761,0 days 00:00:04.325847,logistic,,,,20.0,,8,3.0,49,0.0045367245833986955,311,2,3,PRUNED
66,0.9320541104775589,2025-11-29 23:37:24.679611,2025-11-29 23:37:25.730214,0 days 00:00:01.050603,relu,,,,,200.0,9,5.0,59,0.015434836764462759,254,2,4,PRUNED
67,0.93714874527632,2025-11-29 23:37:25.731625,2025-11-29 23:37:28.215044,0 days 00:00:02.483419,relu,,,64.0,,,7,7.0,57,0.00714211330444637,348,2,2,PRUNED
68,0.9347585800713707,2025-11-29 23:37:28.217883,2025-11-29 23:37:30.758245,0 days 00:00:02.540362,relu,64.0,,,,,9,3.0,64,0.004501179624079177,229,2,0,PRUNED
69,0.9311914747319326,2025-11-29 23:37:30.759140,2025-11-29 23:37:34.454811,0 days 00:00:03.695671,logistic,,,16.0,,,8,5.0,20,0.005168522026438226,369,2,2,PRUNED
70,0.9389843688067373,2025-11-29 23:37:34.455741,2025-11-29 23:37:38.769779,0 days 00:00:04.314038,relu,32.0,,,,,8,9.0,61,0.0042237467008685425,562,2,0,PRUNED
71,0.9167916452451566,2025-11-29 23:37:38.770613,2025-11-29 23:37:42.311337,0 days 00:00:03.540724,relu,64.0,,,,,9,4.0,71,0.0025424705211872555,273,2,0,PRUNED
72,0.9386570660521049,2025-11-29 23:37:42.312170,2025-11-29 23:37:45.249970,0 days 00:00:02.937800,relu,64.0,,,,,7,4.0,76,0.004460331798870959,415,2,0,PRUNED
73,0.9421463220294625,2025-11-29 23:37:45.250782,2025-11-29 23:37:56.831601,0 days 00:00:11.580819,relu,64.0,,,,,5,5.0,73,0.004502300054509112,524,2,0,COMPLETE
74,0.9377277623914393,2025-11-29 23:37:56.832595,2025-11-29 23:38:06.997153,0 days 00:00:10.164558,relu,64.0,,,,,5,5.0,69,0.003077346945007116,565,2,0,COMPLETE
75,0.9314688277736751,2025-11-29 23:38:06.998369,2025-11-29 23:38:10.611010,0 days 00:00:03.612641,relu,64.0,,,,,5,6.0,73,0.0031088981531846513,596,2,0,PRUNED
76,0.9474801596644417,2025-11-29 23:38:10.611878,2025-11-29 23:38:22.207726,0 days 00:00:11.595848,relu,64.0,,,,,5,5.0,69,0.002210149454390482,572,2,0,COMPLETE
77,0.8959346507833903,2025-11-29 23:38:22.208624,2025-11-29 23:38:24.207509,0 days 00:00:01.998885,relu,64.0,,,,,5,6.0,69,0.0022617639557453123,572,2,0,PRUNED
78,0.8959681564936685,2025-11-29 23:38:24.208447,2025-11-29 23:38:30.145281,0 days 00:00:05.936834,logistic,64.0,,,,,4,7.0,66,0.0016450636585244897,553,2,0,PRUNED
79,0.9449082088223334,2025-11-29 23:38:30.146131,2025-11-29 23:38:34.088022,0 days 00:00:03.941891,relu,64.0,,,,,4,5.0,73,0.0029041355932191435,524,2,0,PRUNED
80,0.9417896355310825,2025-11-29 23:38:34.088845,2025-11-29 23:38:44.246346,0 days 00:00:10.157501,relu,64.0,,,,,5,5.0,70,0.0025781358404570404,584,2,0,COMPLETE
81,0.946316153929996,2025-11-29 23:38:44.248290,2025-11-29 23:38:54.793795,0 days 00:00:10.545505,relu,64.0,,,,,5,5.0,70,0.002639825889302764,556,2,0,COMPLETE
82,0.9350233579097769,2025-11-29 23:38:54.795129,2025-11-29 23:39:05.080273,0 days 00:00:10.285144,relu,64.0,,,,,5,5.0,70,0.0025850278539568915,578,2,0,COMPLETE
83,0.9351330093103964,2025-11-29 23:39:05.081260,2025-11-29 23:39:06.640200,0 days 00:00:01.558940,relu,64.0,,,,,5,5.0,67,0.0022091553530244378,557,2,0,PRUNED
84,0.9193228066801256,2025-11-29 23:39:06.641130,2025-11-29 23:39:08.831599,0 days 00:00:02.190469,relu,64.0,,,,,4,6.0,71,0.002324479262313774,586,2,0,PRUNED
85,0.9338450274572425,2025-11-29 23:39:08.832384,2025-11-29 23:39:12.981411,0 days 00:00:04.149027,relu,64.0,,,,,6,8.0,74,0.0031744626746082537,547,2,0,PRUNED
86,0.9407954957239986,2025-11-29 23:39:12.982290,2025-11-29 23:39:26.819160,0 days 00:00:13.836870,relu,64.0,,,,,5,5.0,63,0.0017519488396669847,569,2,0,COMPLETE
87,0.9190240122464869,2025-11-29 23:39:26.820141,2025-11-29 23:39:29.295644,0 days 00:00:02.475503,relu,64.0,,,,,4,6.0,63,0.0019630003087100427,535,2,0,PRUNED
88,0.9014043915586255,2025-11-29 23:39:29.296495,2025-11-29 23:39:35.410356,0 days 00:00:06.113861,logistic,16.0,,,,,5,,78,0.0017220056981030283,590,1,0,PRUNED
89,0.8073475832161711,2025-11-29 23:39:35.411215,2025-11-29 23:39:38.505276,0 days 00:00:03.094061,relu,32.0,,,,,6,5.0,65,0.0008067561036144776,578,2,0,PRUNED
90,0.9190665137131578,2025-11-29 23:39:38.506325,2025-11-29 23:39:59.018001,0 days 00:00:20.511676,relu,64.0,,,,,3,6.0,72,0.0014919177208808725,517,2,0,COMPLETE
91,0.9468030980267045,2025-11-29 23:39:59.018919,2025-11-29 23:40:01.701131,0 days 00:00:02.682212,relu,64.0,,,,,5,5.0,68,0.0019111623498709604,564,2,0,PRUNED
92,0.9464056124867752,2025-11-29 23:40:01.701979,2025-11-29 23:40:04.726327,0 days 00:00:03.024348,relu,64.0,,,,,5,5.0,69,0.0027321396104531817,600,2,0,PRUNED
93,0.9436843209954475,2025-11-29 23:40:04.727156,2025-11-29 23:40:06.547370,0 days 00:00:01.820214,relu,64.0,,,,,5,5.0,68,0.0037758948541180086,569,2,0,PRUNED
94,0.9385054692503119,2025-11-29 23:40:06.548200,2025-11-29 23:40:17.853302,0 days 00:00:11.305102,relu,64.0,,,,,6,10.0,71,0.0033117613544448926,546,2,0,COMPLETE
95,0.9461011482857664,2025-11-29 23:40:17.854259,2025-11-29 23:40:27.061972,0 days 00:00:09.207713,relu,64.0,,,,,6,11.0,75,0.0033489917622034626,528,2,0,COMPLETE
96,0.9394434759963378,2025-11-29 23:40:27.062942,2025-11-29 23:40:45.281737,0 days 00:00:18.218795,relu,32.0,,,,,6,11.0,75,0.003426158328371059,550,2,0,COMPLETE
97,0.9383566983079624,2025-11-29 23:40:45.282801,2025-11-29 23:40:47.992859,0 days 00:00:02.710058,tanh,,64.0,,,,6,11.0,75,0.002350921274629766,492,2,1,PRUNED
98,0.9415280412129913,2025-11-29 23:40:47.993618,2025-11-29 23:40:50.050226,0 days 00:00:02.056608,relu,,,,,100.0,6,,59,0.002733051508597901,528,1,4,PRUNED
99,0.9558890033457228,2025-11-29 23:40:50.051158,2025-11-29 23:41:15.227829,0 days 00:00:25.176671,logistic,32.0,,,,,5,11.0,77,0.002067556922061787,503,2,0,COMPLETE
100,0.9563497332724872,2025-11-29 23:41:15.228781,2025-11-29 23:41:57.889133,0 days 00:00:42.660352,logistic,,,,10.0,,5,11.0,49,0.0021286475534560466,487,2,3,COMPLETE
101,0.9534776718633161,2025-11-29 23:41:57.891663,2025-11-29 23:42:38.289848,0 days 00:00:40.398185,logistic,,,,10.0,,5,11.0,49,0.002105345837258941,487,2,3,COMPLETE
102,0.940232533524772,2025-11-29 23:42:38.293142,2025-11-29 23:42:44.964901,0 days 00:00:06.671759,logistic,32.0,,,,,5,10.0,79,0.0021208629140591754,512,2,0,PRUNED
103,0.9559945022306889,2025-11-29 23:42:44.965826,2025-11-29 23:43:29.002911,0 days 00:00:44.037085,logistic,,,,10.0,,5,11.0,49,0.0018397629652428242,488,2,3,COMPLETE
104,0.9415757536577746,2025-11-29 23:43:29.003958,2025-11-29 23:43:39.407840,0 days 00:00:10.403882,logistic,,,,10.0,,5,11.0,49,0.00145421749883034,489,2,3,PRUNED
105,0.9393737009855779,2025-11-29 23:43:39.408904,2025-11-29 23:43:46.754225,0 days 00:00:07.345321,logistic,,,,10.0,,4,11.0,49,0.0018162432926919652,495,2,3,PRUNED
106,0.9350215263341776,2025-11-29 23:43:46.755084,2025-11-29 23:43:54.209510,0 days 00:00:07.454426,logistic,,,,10.0,,5,10.0,49,0.0021651885083768464,485,2,3,PRUNED
107,0.9390054571971154,2025-11-29 23:43:54.210398,2025-11-29 23:44:04.286382,0 days 00:00:10.075984,logistic,,,,10.0,,5,11.0,44,0.0015032859812251732,494,2,3,PRUNED
108,0.9524360188348219,2025-11-29 23:44:04.287278,2025-11-29 23:44:42.883369,0 days 00:00:38.596091,logistic,,,,10.0,,5,11.0,32,0.001848605511776641,462,2,3,COMPLETE
109,0.9393737009855779,2025-11-29 23:44:42.884332,2025-11-29 23:44:47.848502,0 days 00:00:04.964170,logistic,,,,10.0,,4,11.0,29,0.0018992677861733363,465,2,3,PRUNED
110,0.9565203650430082,2025-11-29 23:44:47.849450,2025-11-29 23:45:31.737745,0 days 00:00:43.888295,logistic,,,,10.0,,5,11.0,37,0.0020704403260743127,483,2,3,COMPLETE
111,0.9549665004341928,2025-11-29 23:45:31.738655,2025-11-29 23:46:12.455259,0 days 00:00:40.716604,logistic,,,,10.0,,5,11.0,36,0.0020570609677259613,485,2,3,COMPLETE
112,0.9539977887446437,2025-11-29 23:46:12.456281,2025-11-29 23:46:51.725351,0 days 00:00:39.269070,logistic,,,,10.0,,5,11.0,37,0.0020182984740849145,484,2,3,COMPLETE
113,0.9489877790994837,2025-11-29 23:46:51.726384,2025-11-29 23:47:00.822938,0 days 00:00:09.096554,logistic,,,,10.0,,5,11.0,37,0.0019875818616691804,451,2,3,PRUNED
114,0.892980061599762,2025-11-29 23:47:00.824790,2025-11-29 23:47:05.732295,0 days 00:00:04.907505,logistic,,,,10.0,,5,10.0,34,0.002073444786614352,483,2,3,PRUNED
115,0.9419327473547894,2025-11-29 23:47:05.733178,2025-11-29 23:47:15.930431,0 days 00:00:10.197253,logistic,,,,10.0,,5,11.0,39,0.0012415876090219298,469,2,3,PRUNED
116,0.9386161300613487,2025-11-29 23:47:15.931521,2025-11-29 23:47:23.084208,0 days 00:00:07.152687,logistic,,,,10.0,,4,11.0,41,0.0015800152290418557,460,2,3,PRUNED
117,0.9223602928668457,2025-11-29 23:47:23.085067,2025-11-29 23:47:35.420204,0 days 00:00:12.335137,logistic,,,,10.0,,6,11.0,32,0.0013513617473129983,476,2,3,PRUNED
118,0.920644777953361,2025-11-29 23:47:35.421123,2025-11-29 23:47:44.192726,0 days 00:00:08.771603,logistic,,,,10.0,,4,10.0,37,0.001826599285557104,444,2,3,PRUNED
119,0.9247778999283323,2025-11-29 23:47:44.193539,2025-11-29 23:47:51.573225,0 days 00:00:07.379686,logistic,,,,10.0,,6,11.0,31,0.002431570213376258,486,2,3,PRUNED
120,0.9485605687304713,2025-11-29 23:47:51.575806,2025-11-29 23:47:58.348983,0 days 00:00:06.773177,logistic,,,,10.0,,5,11.0,27,0.002217442756738493,496,2,3,PRUNED
121,0.9143023464057072,2025-11-29 23:47:58.349850,2025-11-29 23:48:10.652947,0 days 00:00:12.303097,logistic,,,,10.0,,5,11.0,36,0.00037577684536911567,470,2,3,PRUNED
122,0.9540320973218941,2025-11-29 23:48:10.653836,2025-11-29 23:48:50.492665,0 days 00:00:39.838829,logistic,,,,10.0,,5,11.0,42,0.002078147773758106,496,2,3,COMPLETE
123,0.9444969466871883,2025-11-29 23:48:50.493616,2025-11-29 23:48:59.467922,0 days 00:00:08.974306,logistic,,,,10.0,,5,10.0,42,0.002086924958730432,479,2,3,PRUNED
124,0.9484278529418934,2025-11-29 23:48:59.468738,2025-11-29 23:49:05.397629,0 days 00:00:05.928891,logistic,,,,10.0,,5,11.0,46,0.0023244301848564094,487,2,3,PRUNED
125,0.9554704062528707,2025-11-29 23:49:05.398484,2025-11-29 23:49:57.548942,0 days 00:00:52.150458,logistic,,,,10.0,,5,11.0,48,0.00164430109481907,496,2,3,COMPLETE
126,0.9492485739478113,2025-11-29 23:49:57.550011,2025-11-29 23:50:11.995350,0 days 00:00:14.445339,logistic,,,,10.0,,5,11.0,38,0.001662959832646639,496,2,3,PRUNED
127,0.9393737009855779,2025-11-29 23:50:11.996259,2025-11-29 23:50:18.535692,0 days 00:00:06.539433,logistic,,,,10.0,,4,11.0,34,0.0018609584093146764,496,2,3,PRUNED
128,0.9443358497663457,2025-11-29 23:50:18.536571,2025-11-29 23:50:27.093540,0 days 00:00:08.556969,logistic,,,,10.0,,5,10.0,48,0.002015750380684947,483,2,3,PRUNED
129,0.9569268575445609,2025-11-29 23:50:27.095741,2025-11-29 23:51:01.031735,0 days 00:00:33.935994,logistic,,,,10.0,,5,11.0,43,0.002581156946752903,463,2,3,COMPLETE
130,0.9514378886643071,2025-11-29 23:51:01.032700,2025-11-29 23:51:41.803014,0 days 00:00:40.770314,logistic,,,,10.0,,5,11.0,45,0.002671135317903583,458,2,3,COMPLETE
131,0.9510869579777427,2025-11-29 23:51:41.804007,2025-11-29 23:51:48.825642,0 days 00:00:07.021635,logistic,,,,10.0,,5,11.0,44,0.0025499931354430573,476,2,3,PRUNED
132,0.9511959469332864,2025-11-29 23:51:48.826413,2025-11-29 23:51:54.594904,0 days 00:00:05.768491,logistic,,,,10.0,,5,11.0,46,0.0029228743162663363,464,2,3,PRUNED
